{
  "$schema": "../../schema/velox-v1.schema.json",
  "schemaVersion": 1,
  "app": { "id": "dev.velox.progress", "name": "Velox Taskbar Progress", "version": "0.1.0" },
  "window": { "width": 620, "height": 480, "minWidth": 360, "minHeight": 400, "followSystemTheme": true },
  "security": { "permissions": ["window.progress"] }
}
