{
  "$schema": "../../schema/velox-v1.schema.json",
  "schemaVersion": 1,
  "app": {
    "id": "dev.velox.deskboard",
    "name": "Velox Deskboard",
    "version": "0.1.0"
  },
  "assets": {
    "root": "web",
    "entry": "index.html"
  },
  "window": {
    "width": 1180,
    "height": 760
  },
  "security": {
    "permissions": [
      "app.info",
      "window.basic"
    ]
  }
}
