{
  "$schema": "../../schema/velox-v1.schema.json",
  "schemaVersion": 1,
  "app": { "id": "dev.velox.topmost", "name": "Velox Always On Top", "version": "0.1.0" },
  "window": { "width": 480, "height": 360, "minWidth": 320, "minHeight": 240, "alwaysOnTop": true },
  "security": { "permissions": [] }
}
