{
  "$schema": "../../schema/velox-v1.schema.json",
  "schemaVersion": 1,
  "app": {
    "id": "dev.velox.filenotes",
    "name": "Velox File Notes",
    "version": "0.2.0",
    "singleInstance": true
  },
  "branding": {
    "company": "Velox",
    "description": "Local Markdown editor"
  },
  "assets": {
    "root": "web",
    "entry": "index.html"
  },
  "window": {
    "width": 1080,
    "height": 760,
    "rememberState": true,
    "tray": true
  },
  "security": {
    "permissions": ["file.open", "file.save"]
  }
}
